category,stock_code,name,sale_price,original_price,savings,dietary_category,dietary_confidence
Health & Wellbeing,705837,Nature’s Way Kids Smart Vita-Gummies Multivitamin Plus Pk 120^,16.0,32.0,16.0,Dairy (Reduced Fat),0.34945350885391235
Health & Wellbeing,6027587,Nature’s Way Magnesium Glycinate Tablets Pk 130^,22.0,44.0,22.0,Dairy (Reduced Fat),0.3946571350097656
Health & Wellbeing,780054,Nature’s Way Restore Probiotic Capsules Pk 90^,26.5,53.0,26.5,Dairy (Reduced Fat),0.4604465067386627
Health & Wellbeing,243654,Nature’s Way Beauty Collagen Tablets Pk 120^,27.0,54.0,27.0,Dairy (Reduced Fat),0.4141033887863159
Health & Wellbeing,780021,Centrum Women 50+ Daily Multivitamin Tablets Pk 60^,11.25,22.5,11.25,Dairy (Reduced Fat),0.4339970648288727
Health & Wellbeing,702125,Centrum Advance 50+ Multivitamin Tablets Pk 120^,13.5,27.0,13.5,Dairy (Reduced Fat),0.4072053134441376
Health & Wellbeing,702124,Centrum Advance Daily Multivitamin Tablets Pk 120^,13.5,27.0,13.5,Dairy (Reduced Fat),0.4166267216205597
Health & Wellbeing,6010212,Swisse Ultiboost Magnesium Glycinate Tablets Pk 60^,14.75,29.5,14.75,Dairy (Reduced Fat),0.38542234897613525
Health & Wellbeing,90409,"Swisse Ultiboost Magnesium, Calcium + D3 Tablets Pk 120^",14.75,29.5,14.75,Dairy (Reduced Fat),0.4113582670688629
Health & Wellbeing,725175,Swisse Ultiboost Magnesium Tablets Pk 120^,19.75,39.5,19.75,Dairy (Reduced Fat),0.38542234897613525
Health & Wellbeing,345775,Swisse Ultiboost Liver Detox Tablets Pk 60^,12.5,25.0,12.5,Dairy (Reduced Fat),0.36847999691963196
Health & Wellbeing,307062,Swisse Ultivite Men’s Multivitamin Tablets Pk 60^,19.75,39.5,19.75,Dairy (Reduced Fat),0.3984392285346985
Health & Wellbeing,307061,Swisse Ultivite Women’s Multivitamin Tablets Pk 60^,19.75,39.5,19.75,Dairy (Reduced Fat),0.3984392285346985
Health & Wellbeing,617013,Hydralyte Effervescent Electrolyte Pk 10~,4.35,8.7,4.35,Dairy (Reduced Fat),0.3556784987449646
Health & Wellbeing,197043,Colgate Advanced Whitening Toothpaste 200g,5.0,10.0,5.0,Dairy (Reduced Fat),0.4178183078765869
Health & Wellbeing,402160,Nivea SPF 50+ Sun Protect & Moisture Sunscreen 400ml^,14.0,28.0,14.0,Dairy (Reduced Fat),0.35225293040275574
Health & Wellbeing,748551,U by Kotex Ultra Thin Pads Pk 8-14 or U by Kotex Maxi Pads Pk 6-16,3.9,5.6,1.7,Grains (Wholegrain),0.27660998702049255
Health Foods,65464,Vege Chips 100g or Rice Crackers 75g – From the Health Food Aisle,2.45,4.9,2.45,Grains (Wholegrain),0.6951516270637512
Health Foods,913555,Muscle Nation Protein Custard Bars 60g~,2.25,4.5,2.25,Dairy (Reduced Fat),0.6165452599525452
Health Foods,6041651,Muscle Nation High Protein Bars 70g~,2.75,5.5,2.75,Lean Meat & Alternatives,0.4834308922290802
Health Foods,913387,Muscle Nation Cheesecake Protein Bars 50g~,2.25,4.5,2.25,Lean Meat & Alternatives,0.5931394100189209
Health Foods,256363,The Man Bar or The Lady Bar 50g~,2.25,4.5,2.25,Grains (Wholegrain),0.40404364466667175
Health Foods,6041554,Muscle Nation Protein Cups 50g~,2.5,5.0,2.5,Dairy (Reduced Fat),0.5466600060462952
Health Foods,386871,Fat Blaster Weight Loss Shake 465g~,14.0,28.0,14.0,Dairy (Reduced Fat),0.4716869294643402
Health Foods,76529,Nature’s Way Protein Powder 400g~,14.0,28.0,14.0,Dairy (Reduced Fat),0.5921043157577515
Health Foods,6041500,Keep It Cleaner Daily Boost Protein Powder 340g~,16.5,33.0,16.5,Dairy (Reduced Fat),0.5522376298904419
International Foods,6036366,Old El Paso Street Market Taco Kits 255-257g,3.25,6.5,3.25,Grains (Wholegrain),0.5436394214630127
International Foods,8317,Old El Paso Family Size Kits 495-1040g,10.8,22.8,12.0,Grains (Wholegrain),0.4634290039539337
Jams & Spreads,69756,Western Star Spreadable 500g – From the Fridge,6.7,14.2,7.5,Dairy (Reduced Fat),0.5301526784896851
Jams & Spreads,26662,St Dalfour Spreads 284g,4.3,6.199999999999999,1.9,Grains (Wholegrain),0.2862681448459625
Jams & Spreads,6025985,Duo Penotti Spread 350g,4.5,7.5,3.0,Grains (Wholegrain),0.27331987023353577
Meat,83728,Woolworths Premium Butcher Style Sausage Varieties 450-500g,15.0,18.0,3.0,Lean Meat & Alternatives,0.7707741856575012
Meat,908246,Woolworths Marinated Kebabs with RSPCA Approved Chicken 375g Pk 6,7.0,8.0,1.0,Lean Meat & Alternatives,0.7888779640197754
Meat,6026224,Woolworths Marinated Chicken Breast Steak Varieties with RSPCA Approved Chicken 500g,8.5,10.5,2.0,Lean Meat & Alternatives,0.8460291624069214
Meat,821038,Woolworths COOK Slow Cooked Beef Brisket with Bourbon Flavoured BBQ Sauce 700g,14.5,16.5,2.0,Lean Meat & Alternatives,0.7897246479988098
Meat,765062,Australian Lamb Forequarter Chops,19.0,23.0,4.0,Lean Meat & Alternatives,0.7625908851623535
Meat,6022459,Australian Beef Rib Eye Bone In Sharing Steak,38.0,48.0,10.0,Lean Meat & Alternatives,0.7221003770828247
Meat,686853,Australian Beef Sizzle Steak 400g,12.0,25.0,13.0,Lean Meat & Alternatives,0.7711486220359802
Meat,351196,Chicken Breast Schnitzel Varieties – From the Deli,1.5,3.0,1.5,Lean Meat & Alternatives,0.8172070980072021
Meat,,Middle Bacon Rashers – From the Deli,13.0,19.0,6.0,Lean Meat & Alternatives,0.8109877705574036
Meat,67486,Don Premium Smokehouse Leg Ham – Sliced or Shaved – From the Deli,28.0,34.0,6.0,Lean Meat & Alternatives,0.7073523998260498
Meat,14627,Bertocchi Sopressa Salami Made with Australian Pork – Mild or Hot – Sliced – From the Deli,30.0,34.0,4.0,Lean Meat & Alternatives,0.758990466594696
Meat,64119,Don Salami Varieties 200g – From the Deli,13.0,14.0,1.0,Lean Meat & Alternatives,0.7354824542999268
Meat,544764,Primo Sliced Meats 80-100g,3.0,3.95,0.95,Lean Meat & Alternatives,0.772541880607605
Meat,6009025,Barossa Fine Foods Delicatessen Varieties 80-120g – From the Deli,4.8,6.0,1.2,Lean Meat & Alternatives,0.6938635110855103
Meat,6008517,Hans Mild Twiggy Sticks 500g – From the Deli,11.0,16.0,5.0,Lean Meat & Alternatives,0.6317760348320007
Meat,744416,Primo Cabanossi – From the Deli,22.0,24.0,2.0,Lean Meat & Alternatives,0.671387791633606
Meat,170438,Woolworths Australian Half Leg Ham,8.0,8.0,0.0,Lean Meat & Alternatives,0.7268984913825989
Meat,546644,Woolworths Australian Double Smoked Half Leg Ham,13.0,13.0,0.0,Lean Meat & Alternatives,0.6968281269073486
Meat,922923,Woolworths Australian Quarter Leg Ham,12.5,12.5,0.0,Lean Meat & Alternatives,0.7100342512130737
Meat,66904,Woolworths Australian Easy Carve Shoulder Ham,10.0,10.0,0.0,Lean Meat & Alternatives,0.6597439050674438
Meat,764527,Australian Pork Leg Boneless Roast,9.0,12.0,3.0,Lean Meat & Alternatives,0.8147212862968445
Meat,927524,Macro Free Range Australian Fresh Whole Plain RSPCA Approved Chicken – From the Meat Dept,5.5,6.5,1.0,Lean Meat & Alternatives,0.6541649103164673
Meat,294782,Woolworths Gold Sliced Smoked Ham off the Bone 500g,14.0,14.0,0.0,Lean Meat & Alternatives,0.7243137955665588
Meat,,Bertocchi Mini Easy Carve Leg Ham,22.0,22.0,0.0,Lean Meat & Alternatives,0.6710093021392822
Meat,29487,Ingham’s Frozen Whole Turkey^ – From the Freezer,7.9,7.9,0.0,Lean Meat & Alternatives,0.6909409761428833
Meat,767632,Ingham’s Turkey Easy Carve Buffe^ – From the Freezer,9.5,9.5,0.0,Lean Meat & Alternatives,0.7258967757225037
Meat,89785,Ingham’s Traditional Turkey Thigh Roast 1 kg – From the Freezer,13.0,13.0,0.0,Lean Meat & Alternatives,0.7543773055076599
Meat,6044201,Woolworths BBQ Texas Style Butterflied Boneless RSPCA Approved Chicken,10.0,11.0,1.0,Lean Meat & Alternatives,0.7646567225456238
Meat,321141,Woolworths BBQ Butterflied Lamb Leg Garlic and Herbs,18.0,43.0,25.0,Lean Meat & Alternatives,0.8116425275802612
Meat,6027947,Woolworths BBQ Beef Flank with Chimichurri Drizzle,25.0,30.0,5.0,Lean Meat & Alternatives,0.7403016686439514
Meat,6027948,Woolworths BBQ Salt & Chilli Pork Belly Strips with Hot Honey Drizzle,25.0,30.0,5.0,Lean Meat & Alternatives,0.7970113158226013
Meat,6033560,Woolworths Gourmet Pork Sausage with Hot Honey Drizzle 500g,15.0,18.0,3.0,Lean Meat & Alternatives,0.8364884853363037
Seafood,844680,Australian Fresh Saltwater Barramundi Fillets Skin On,26.0,38.0,12.0,Lean Meat & Alternatives,0.7029772400856018
Seafood,674710,Sealord Fish Bites 340-400g,7.5,9.0,1.5,Lean Meat & Alternatives,0.7261902689933777
Seafood,365407,Ocean Blue Smoked Salmon 300g,15.0,19.0,4.0,Lean Meat & Alternatives,0.6624940037727356
Seafood,96995,Thawed Large Australian Green Banana Prawns,17.0,22.0,5.0,Lean Meat & Alternatives,0.7001038789749146
Seafood,157054,Woolworths Australian Fresh Salmon Portions Skin On 460g,17.5,37.0,19.5,Lean Meat & Alternatives,0.7120987176895142
Seafood,65031,Thawed Large Australian Cooked Tiger Prawns,26.0,35.0,9.0,Lean Meat & Alternatives,0.7340993285179138
